,time,player,age,round,text
0,2020-06-15 13:29:42,Orange,IV,19,End of gameCheck the journal to get the final impacts effects : Impact of Colonies Impact of Competition Impact of Government WINNER IS X L AS GREEN (165 PTS) 2nd is David Li as Orange (128 pts) 3rd is teddy yeh as Grey (122 pts) 4th is Micah Yospe as Purple (resigned)
1,2020-06-15 13:29:42,Grey,IV,19,Impact of GovernmentEach civilization scores 2 culture per civil action and 1 culture per military action. Orange scores 18 culture Green scores 19 culture Grey scores 16 culture
2,2020-06-15 13:29:40,Grey,IV,19,Impact of CompetitionEach civilization scores 1 culture per level of each of its military units and arenas. Orange scores 16 culture Green scores 7 culture Grey scores 9 culture
3,2020-06-15 13:29:39,Grey,IV,19,Impact of ColoniesEach civilization scores 3 culture per colony. Orange scores 6 culture Green scores 3 culture
4,2020-06-15 13:29:38,Grey,IV,19,End turnGrey scores: 12 culture (now 97) 4 science (now 9) 0 food - consumption: 4 (now 6) 6 resources (now 7)
5,2020-06-15 13:29:37,Grey,IV,18,End turnGrey scores: 12 culture (now 97) 4 science (now 9) 0 food - consumption: 4 (now 6) 6 resources (now 7)
6,2020-06-15 13:29:36,Grey,IV,18,No Discard Phase
7,2020-06-15 13:29:23,Grey,IV,18,Grey builds MoviesGrey spends 10 resources
8,2020-06-15 13:29:14,Grey,IV,18,Grey increases populationGrey spends 7 food
9,2020-06-15 13:28:54,Grey,IV,18,Grey plays eventGrey scores 3 culture Current event: II / Prosperity Each civilization gains 1 food for each of its happy faces (max 8). Orange produces 8 food Green produces 4 food Grey produces 7 food
10,2020-06-15 13:27:16,Green,IV,18,End turnWinston Churchill scores 3 culture. Green scores: 17 culture (now 136) 3 science (now 8) 2 food - consumption: 3 (now 6) 6 resources (now 6)
11,2020-06-15 13:27:15,Green,IV,18,No Discard Phase
12,2020-06-15 13:26:33,Green,IV,18,Green builds 1 stage of Fast Food ChainsGreen spends 4 resources Wonder completed Green scores 20 culture
13,2020-06-15 13:26:25,Green,IV,18,Green builds 1 stage of Fast Food ChainsGreen spends 4 resources
14,2020-06-15 13:26:17,Green,IV,18,Green plays ReservesGreen produces 4 resources
15,2020-06-15 13:25:55,Green,IV,18,Green builds AgricultureGreen spends 2 resources
16,2020-06-15 13:25:37,Green,IV,18,Green destroys Alchemy
17,2020-06-15 13:25:21,Green,IV,18,Green builds ReligionGreen spends 3 resources
18,2020-06-15 13:23:58,Green,IV,18,Green plays Engineering GeniusGreen builds 1 stage of Fast Food Chains
19,2020-06-15 13:23:19,Green,IV,18,Green passes Political Phase
20,2020-06-15 13:21:41,Orange,IV,18,End turnOrange scores: 12 culture (now 88) 4 science (now 4) 3 food - consumption: 3 (now 3) 6 resources (now 7)
21,2020-06-15 13:21:39,Orange,IV,18,No Discard Phase
22,2020-06-15 13:21:33,Orange,IV,18,Orange sets up new tacticsIII / Modern Army
23,2020-06-15 13:21:18,Orange,IV,18,Orange sets up new tacticsIII / Mechanized Army
24,2020-06-15 13:21:03,Orange,IV,18,Orange takes Air Forces in handOrange uses 1 civil action
25,2020-06-15 13:20:58,Orange,IV,18,Orange plays Military Build-Up
26,2020-06-15 13:20:52,Orange,IV,18,Orange builds RiflemenOrange spends 5 resources
27,2020-06-15 13:20:26,Orange,IV,18,Orange increases populationOrange spends 5 food
28,2020-06-15 13:20:20,Orange,IV,18,Orange builds MoviesOrange spends 8 resources
29,2020-06-15 13:20:15,Orange,IV,18,Orange discovers MoviesOrange loses 10 science
30,2020-06-15 13:20:08,Orange,IV,18,Orange increases populationOrange spends 4 food
31,2020-06-15 13:18:09,Orange,IV,18,Orange plays eventOrange scores 3 culture Current event: II / National Pride The civilization with the most culture points scores 5 culture. Green scores 5 culture
32,2020-06-15 13:17:55,Orange,IV,18,Last turnGame ends at the end of the starting round
33,2020-06-15 13:17:55,Grey,IV,18,Last turnGame ends at the end of the starting round
34,2020-06-15 13:17:55,Grey,IV,17,End turnGrey scores: 8 culture (now 82) 4 science (now 5) 0 food - consumption: 4 (now 6) 6 resources (now 11)
35,2020-06-15 13:17:53,Grey,IV,17,No Discard Phase
36,2020-06-15 13:17:47,Grey,IV,17,Grey takes Air Forces in handGrey uses 2 civil action
37,2020-06-15 13:17:34,Grey,IV,17,Grey discovers MoviesGrey loses 10 science
38,2020-06-15 13:17:24,Grey,IV,17,Grey discovers SatellitesGrey loses 8 science
39,2020-06-15 13:17:18,Grey,IV,17,Grey builds ReligionGrey spends 3 resources
40,2020-06-15 13:16:32,Grey,IV,17,Grey takes Satellites in handGrey uses 1 civil action
41,2020-06-15 13:16:27,Grey,IV,17,Grey passes Political Phase
42,2020-06-15 13:14:06,Green,IV,17,End turnWinston Churchill scores 3 culture. Green scores: CORRUPTION! Green loses 2 resources 16 culture (now 94) 5 science (now 5) 1 food - consumption: 3 (now 4) 4 resources (now 9)
43,2020-06-15 13:14:05,Green,IV,17,No Discard Phase
44,2020-06-15 13:13:05,Green,IV,17,Green takes Engineering Genius in handGreen uses 2 civil action
45,2020-06-15 13:06:34,Green,IV,17,Green builds Multimedia using Urban GrowthGreen spends 7 resources
46,2020-06-15 13:06:20,Green,IV,17,Green discovers MultimediaGreen loses 9 science
47,2020-06-15 13:06:02,Green,IV,17,Green destroys Alchemy
48,2020-06-15 13:05:26,Green,IV,17,Green takes Multimedia in handGreen uses 1 civil action
49,2020-06-15 13:05:17,Green,IV,17,Green plays Endowment for the ArtsGreen scores 6 culture
50,2020-06-15 12:50:53,Grey,IV,17,Grey defends1 Defense card +6 played 1 military card played Grey strength: 23 Green strength: 23
51,2020-06-15 12:50:31,Green,IV,17,Green plays Plunder against GreyYour rival loses a total of up to 7 resource and/or food (your choice). You gain that many resource and food. Green uses 2 military action
52,2020-06-15 12:47:05,Orange,III,17,End turnOrange scores: 4 culture (now 73) 4 science (now 10) 4 food - consumption: 2 (now 9) 6 resources (now 14) Orange draws 3 military cards
53,2020-06-15 12:47:04,Orange,III,17,No Discard Phase
54,2020-06-15 12:46:38,Orange,III,17,Orange discovers EngineeringOrange loses 9 science
55,2020-06-15 12:46:16,Orange,III,17,Orange takes Engineering in handOrange uses 1 civil action
56,2020-06-15 12:46:11,Orange,III,17,Orange elects Charles ChaplinNapoleon Bonaparte dies Orange gets 1 civil action
57,2020-06-15 12:45:56,Orange,III,17,Orange takes Movies in handOrange uses 2 civil action
58,2020-06-15 12:45:52,Orange,III,17,Orange takes Charles Chaplin in handOrange uses 2 civil action
59,2020-06-15 12:40:32,Orange,III,17,Orange colonizes a Developed TerritorySacrificed Units: 1 Knights 1 Colonization card +2 1 Colonization card +2 Colonization bonus: +3 Total force: 9 Orange gets 5 science
60,2020-06-15 12:39:53,Grey,III,17,Orange wins Developed TerritoryWinning bid is 9
61,2020-06-15 12:39:53,Grey,III,17,Grey passes
62,2020-06-15 12:24:45,Orange,III,17,Orange bids 9
63,2020-06-15 12:23:05,Grey,III,17,Grey bids 8
64,2020-06-15 12:22:26,Green,III,17,Green passes
65,2020-06-15 12:20:42,Orange,III,17,Orange bids 7
66,2020-06-15 12:19:15,Orange,III,17,Orange plays eventOrange scores 3 culture Current event: II / Developed Territory 5 science
67,2020-06-15 12:18:02,Grey,III,16,End turnGrey scores: 7 culture (now 74) 4 science (now 19) 1 food - consumption: 3 (now 6) 6 resources (now 8) Grey draws 3 military cards
68,2020-06-15 12:17:58,Grey,III,16,Grey discards 3 cards
69,2020-06-15 12:16:45,Grey,III,16,Discard Phase3 military cards must be discarded
70,2020-06-15 12:16:27,Grey,III,16,Grey takes Rockets in handGrey uses 1 civil action
71,2020-06-15 12:16:19,Grey,III,16,Grey takes Movies in handGrey uses 2 civil action
72,2020-06-15 12:16:14,Grey,III,16,Grey puts Satellites back in the rowGrey gets 3 civil action
73,2020-06-15 12:16:05,Grey,III,16,Grey takes Satellites in handGrey uses 3 civil action
74,2020-06-15 12:15:45,Grey,III,16,Grey upgrades Bronze to Coal using Efficient UpgradeGrey spends 3 resources
75,2020-06-15 12:15:33,Grey,III,16,Grey plays ReservesGrey produces 4 resources
76,2020-06-15 12:15:20,Grey,III,16,Grey builds BronzeGrey spends 2 resources
77,2020-06-15 12:14:59,Grey,III,16,Grey passes Political Phase
78,2020-06-15 12:04:26,Green,III,16,End turnWinston Churchill scores 3 culture. Green scores: 13 culture (now 72) 4 science (now 9) 2 food - consumption: 2 (now 3) 6 resources (now 12) Green draws 3 military cards
79,2020-06-15 12:04:23,Green,III,16,No Discard Phase
80,2020-06-15 12:02:59,Green,III,16,Green takes Endowment for the Arts in handGreen uses 3 civil action
81,2020-06-15 12:02:54,Green,III,16,Green takes Reserves in handGreen uses 3 civil action
82,2020-06-15 12:02:47,Green,III,16,Green increases populationGreen spends 4 food
83,2020-06-15 12:02:29,Green,III,16,Green passes Political Phase
84,2020-06-15 11:57:26,Purple,III,16,Micah Yospe quitsOrange scores 7 culture
85,2020-06-15 11:46:27,Orange,III,16,End turnOrange scores: 4 culture (now 59) 4 science (now 10) 3 food - consumption: 3 (now 5) 6 resources (now 8) Orange draws 2 military cards
86,2020-06-15 11:46:24,Orange,III,16,Orange discards 2 cards
87,2020-06-15 11:45:52,Orange,III,16,Discard Phase1 military card must be discarded
88,2020-06-15 11:44:42,Orange,III,16,Orange takes Modern Infantry in handOrange uses 2 civil action
89,2020-06-15 11:44:37,Orange,III,16,Orange takes Military Build-Up in handOrange uses 3 civil action
90,2020-06-15 11:44:03,Orange,III,16,Orange upgrades Warrior to RiflemenOrange spends 3 resources
91,2020-06-15 11:43:59,Orange,III,16,Orange upgrades Warrior to RiflemenOrange spends 3 resources
92,2020-06-15 11:43:53,Orange,III,16,Orange builds KnightsOrange spends 3 resources
93,2020-06-15 11:43:45,Orange,III,16,Orange increases populationOrange spends 4 food
94,2020-06-15 11:43:36,Orange,III,16,Orange declares War over Culture on PurpleThe victor takes 5 culture + 1 culture for each point of strength advantage from the defeated civilization. Orange uses 3 military action
95,2020-06-15 11:41:59,Grey,III,15,End turnGrey scores: 7 culture (now 67) 4 science (now 15) 1 food - consumption: 3 (now 5) 3 resources (now 3) Grey draws 3 military cards
96,2020-06-15 11:41:58,Grey,III,15,Grey discards 3 cards
97,2020-06-15 11:41:47,Grey,III,15,Discard Phase3 military cards must be discarded
98,2020-06-15 11:40:48,Grey,III,15,Grey takes Computers in handGrey uses 1 civil action
99,2020-06-15 11:40:40,Grey,III,15,Grey plays Revolutionary IdeaGrey gets 4 science
100,2020-06-15 11:40:32,Grey,III,15,Grey puts Mechanized Agriculture back in the rowGrey gets 2 civil action
101,2020-06-15 11:40:18,Grey,III,15,Grey takes Mechanized Agriculture in handGrey uses 2 civil action
102,2020-06-15 11:39:18,Grey,III,15,Grey takes Reserves in handGrey uses 3 civil action
103,2020-06-15 11:38:49,Grey,III,15,Grey builds Professional Sports using Urban GrowthGrey spends 3 resources
104,2020-06-15 11:38:32,Grey,III,15,Grey passes Political Phase
105,2020-06-15 11:19:33,Green,III,15,End turnGreen scores: 10 culture (now 59) 4 science (now 5) 2 food - consumption: 2 (now 5) 6 resources (now 6)
106,2020-06-15 11:19:32,Green,III,15,No Discard Phase
107,2020-06-15 11:18:31,Green,III,15,Green upgrades Warrior to RiflemenGreen spends 3 resources
108,2020-06-15 11:18:26,Green,III,15,Green upgrades Warrior to RiflemenGreen loses 3 military resource
109,2020-06-15 11:18:21,Green,III,15,Green discovers RiflemenGreen loses 3 military science Green loses 3 science
110,2020-06-15 11:18:14,Green,III,15,"I have nothing to offer but blood, toil, tears, and sweat.Green gets 3 military resource Green gets 3 military science"
111,2020-06-15 11:16:38,Green,III,15,Green takes Air Forces in handGreen uses 1 civil action
112,2020-06-15 11:16:24,Green,III,15,Green takes Civil Service in handGreen uses 1 civil action
113,2020-06-15 11:14:26,Green,III,15,Green plays Engineering GeniusGreen builds 1 stage of Fast Food Chains
114,2020-06-15 11:14:06,Green,III,15,Green adopts existing tacticsII / Napoleonic Army
115,2020-06-15 11:13:55,Green,III,15,Green builds CannonGreen spends 5 resources
116,2020-06-15 11:13:48,Green,III,15,Green discovers CannonGreen loses 6 science
117,2020-06-15 11:12:33,Green,III,15,Green plays Revolutionary IdeaGreen gets 6 science
118,2020-06-15 11:12:20,Green,III,15,Green increases populationGreen spends 4 food
119,2020-06-15 11:12:12,Green,III,15,Green passes Political Phase
120,2020-06-15 11:10:27,Purple,III,15,End turnPurple scores: 10 culture (now 64) 5 science (now 11) 2 food - consumption: 2 (now 3) 3 resources (now 3) Purple draws 2 military cards
121,2020-06-15 11:10:26,Purple,III,15,Purple discards 1 card
122,2020-06-15 11:10:16,Purple,III,15,Discard Phase1 military card must be discarded
123,2020-06-15 11:10:03,Purple,III,15,Purple takes Military Theory in handPurple uses 1 civil action
124,2020-06-15 11:09:48,Purple,III,15,Purple takes Efficient Upgrade in handPurple uses 2 civil action
125,2020-06-15 11:09:12,Purple,III,15,Purple builds WarriorPurple spends 2 resources
126,2020-06-15 11:09:04,Purple,III,15,Purple builds WarriorPurple spends 2 resources
127,2020-06-15 11:08:52,Purple,III,15,Purple increases populationPurple spends 4 food
128,2020-06-15 11:08:21,Purple,III,15,Purple upgrades Religion to Organized Religion using Efficient Upgrade
129,2020-06-15 11:07:57,Purple,III,15,Purple plays ReservesPurple produces 4 resources
130,2020-06-15 11:07:35,Purple,III,15,Purple builds ReligionPurple spends 3 resources
131,2020-06-15 11:07:20,Purple,III,15,Purple passes Political Phase
132,2020-06-15 11:03:26,Orange,III,15,End turnOrange scores: 4 culture (now 55) 4 science (now 6) 4 food - consumption: 2 (now 6) 6 resources (now 11) Orange draws 3 military cards
133,2020-06-15 11:03:24,Orange,III,15,No Discard Phase
134,2020-06-15 11:03:19,Orange,III,15,Orange takes Multimedia in handOrange uses 1 civil action
135,2020-06-15 11:03:08,Orange,III,15,Orange builds CannonOrange spends 5 resources
136,2020-06-15 11:02:50,Orange,III,15,Orange upgrades Warrior to RiflemenOrange spends 3 resources
137,2020-06-15 11:02:38,Orange,III,15,Orange discovers RiflemenOrange loses 6 science
138,2020-06-15 11:02:34,Orange,III,15,Orange plays Revolutionary IdeaOrange gets 6 science
139,2020-06-15 11:02:27,Orange,III,15,Orange discovers Military TheoryOrange loses 11 science
140,2020-06-15 11:02:22,Orange,III,15,Orange takes Military Theory in handOrange uses 1 civil action
141,2020-06-15 11:02:17,Orange,III,15,Orange increases populationOrange spends 4 food
142,2020-06-15 10:55:24,Orange,III,15,Raid casualties1 Printing Press 1 Religion Orange produces 3 resources
143,2020-06-15 10:54:50,Purple,III,15,concedes defeat
144,2020-06-15 10:54:08,Orange,III,15,"Orange plays Raid against PurpleDestroy up to 2 of your rival's urban buildings: one of age III or older and one of age II or older. You gain resources equal to half their total cost, rounded up. Orange uses 3 military action"
145,2020-06-15 10:53:50,Grey,III,14,End turnGrey scores: 7 culture (now 60) 4 science (now 7) 1 food - consumption: 3 (now 4) 3 resources (now 3) Grey draws 3 military cards
146,2020-06-15 10:53:49,Grey,III,14,No Discard Phase
147,2020-06-15 10:53:17,Grey,III,14,Grey upgrades Bronze to Coal using Rich LandGrey spends 3 resources
148,2020-06-15 10:53:03,Grey,III,14,Grey takes Urban Growth in handGrey uses 2 civil action
149,2020-06-15 10:52:57,Grey,III,14,Grey elects Mahatma GandhiIsaac Newton dies Grey gets 1 civil action
150,2020-06-15 10:52:46,Grey,III,14,Grey takes Mahatma Gandhi in handGrey uses 2 civil action
151,2020-06-15 10:52:40,Grey,III,14,Grey discovers Professional SportsGrey loses 7 science Grey gets 1 civil action
152,2020-06-15 10:52:33,Grey,III,14,Grey takes Professional Sports in handGrey uses 1 civil action
153,2020-06-15 10:49:04,Grey,III,14,Grey passes Political Phase
154,2020-06-15 08:38:03,Green,III,14,End turnWinston Churchill scores 3 culture. Green scores: 13 culture (now 49) 4 science (now 4) 2 food - consumption: 2 (now 7) 6 resources (now 8)
155,2020-06-15 08:38:01,Green,III,14,No Discard Phase
156,2020-06-15 08:37:46,Green,III,14,Green upgrades Bronze to IronGreen spends 3 resources
157,2020-06-15 08:37:35,Green,III,14,Green takes Urban Growth in handGreen uses 2 civil action
158,2020-06-15 08:37:03,Green,III,14,Green elects Winston ChurchillMaximillien Robespierre dies Green gets 1 civil action
159,2020-06-15 08:36:55,Green,III,14,Green takes Winston Churchill in handGreen uses 3 civil action
160,2020-06-15 08:36:07,Green,III,14,Green revolutionsChange government to Democracy 9 science points spent Green loses 9 science Green scores 3 culture
161,2020-06-15 08:35:57,Green,III,14,Green takes Democracy in handGreen uses 1 civil action
162,2020-06-15 08:35:33,Orange,III,14,Orange accepts pact offer
163,2020-06-15 08:34:23,Green,III,14,Green proposes Peace Treaty to OrangeGreen is A Orange is B The two civilizations cannot attack each other. Each civilization produces 1 extra culture.
164,2020-06-15 08:32:53,Green,III,14,Grey wins War over CultureAttacker's strength: 12 Defender's strength: 13
165,2020-06-15 08:32:52,Purple,III,14,End turnPurple scores: 11 culture (now 54) 6 science (now 6) 2 food - consumption: 2 (now 5) 3 resources (now 3) Purple draws 3 military cards
166,2020-06-15 08:32:51,Purple,III,14,No Discard Phase
167,2020-06-15 08:32:24,Purple,III,14,Purple takes Modern Infantry in handPurple uses 1 civil action
168,2020-06-15 08:31:58,Purple,III,14,Purple takes Reserves in handPurple uses 2 civil action
169,2020-06-15 08:31:49,Purple,III,14,Purple takes Efficient Upgrade in handPurple uses 2 civil action
170,2020-06-15 08:31:28,Purple,III,14,Purple builds Printing PressPurple spends 3 resources
171,2020-06-15 08:30:48,Purple,III,14,Purple discovers DemocracyPurple loses 17 science
172,2020-06-15 08:29:44,Purple,III,14,Purple passes Political Phase
173,2020-06-14 12:19:37,Orange,III,14,End turnOrange scores: 3 culture (now 51) 4 science (now 13) 4 food - consumption: 2 (now 6) 6 resources (now 10) Orange draws 3 military cards
174,2020-06-14 12:19:36,Orange,III,14,Orange discards 1 card
175,2020-06-14 12:19:31,Orange,III,14,Discard Phase1 military card must be discarded
176,2020-06-14 12:17:33,Orange,III,14,Orange builds WarriorOrange spends 2 resources
177,2020-06-14 12:17:25,Orange,III,14,Orange destroys Religion
178,2020-06-14 12:16:55,Orange,III,14,Orange takes Revolutionary Idea in handOrange uses 1 civil action
179,2020-06-14 12:16:52,Orange,III,14,Orange discovers NavigationOrange loses 6 science
180,2020-06-14 12:16:32,Orange,III,14,Orange builds CannonOrange loses 4 military resource Orange spends 1 resource
181,2020-06-14 12:16:20,Orange,III,14,Orange plays PatriotismOrange gets 4 military resource Orange gets 1 military action
182,2020-06-14 12:15:54,Orange,III,14,Orange takes Tanks in handOrange uses 1 civil action
183,2020-06-14 12:15:49,Orange,III,14,Orange increases populationOrange spends 4 food
184,2020-06-14 12:13:52,Orange,III,14,Orange plays eventOrange scores 2 culture Current event: II / Cold War The two strongest civilizations score 6 science. Orange scores 6 science Purple scores 6 science
185,2020-06-14 11:43:20,Grey,III,13,End turnGrey scores: 5 culture (now 47) 6 science (now 10) 1 food - consumption: 3 (now 3) 1 resources (now 3)
186,2020-06-14 11:43:16,Grey,III,13,Grey discards 1 card
187,2020-06-14 11:43:10,Grey,III,13,Discard Phase1 military card must be discarded
188,2020-06-14 11:42:39,Grey,III,13,Grey takes Revolutionary Idea in handGrey uses 1 civil action
189,2020-06-14 11:42:32,Grey,III,13,Grey destroys Bronze
190,2020-06-14 11:42:24,Grey,III,13,Grey destroys Bronze
191,2020-06-14 11:42:09,Grey,III,13,Grey destroys Scientific Method
192,2020-06-14 11:41:34,Grey,III,13,Grey discovers CoalGrey loses 7 science Grey gets 1 civil action
193,2020-06-14 11:41:04,Grey,III,13,Grey builds CavalrymenGrey loses 1 military resource Grey spends 4 resources
194,2020-06-14 11:40:54,Grey,III,13,Grey increases populationGrey spends 5 food
195,2020-06-14 11:40:43,Grey,III,13,Grey adopts existing tacticsI / Phalanx
196,2020-06-14 11:39:48,Grey,III,13,Grey builds CavalrymenGrey loses 5 military resource
197,2020-06-14 11:39:33,Grey,III,13,Grey plays Wave of NationalismGrey gets 6 military resource
198,2020-06-14 11:39:25,Grey,III,13,Grey discovers CavalrymenGrey loses 6 science Grey gets 1 civil action
199,2020-06-14 11:39:16,Grey,III,13,Grey passes Political Phase
200,2020-06-14 09:50:54,Green,III,13,End turnGreen scores: 6 culture (now 39) 4 science (now 9) 2 food - consumption: 2 (now 5) 5 resources (now 5)
201,2020-06-14 09:50:50,Green,III,13,No Discard Phase
202,2020-06-14 09:50:30,Green,III,13,Green takes Fast Food Chains in handGreen uses 3 civil action
203,2020-06-14 09:48:55,Green,III,13,Green takes Revolutionary Idea in handGreen uses 2 civil action
204,2020-06-14 09:44:43,Green,III,13,Green upgrades Bronze to IronGreen spends 3 resources
205,2020-06-14 09:44:33,Green,III,13,Green builds WarriorGreen spends 2 resources
206,2020-06-14 09:44:25,Green,III,13,Green builds KnightsGreen spends 3 resources
207,2020-06-14 09:44:10,Green,III,13,Green increases populationGreen spends 3 food
208,2020-06-14 09:43:56,Green,III,13,Green declares War over Culture on GreyThe victor takes 5 culture + 1 culture for each point of strength advantage from the defeated civilization. Green uses 3 military action
209,2020-06-14 05:11:49,Purple,III,13,End turnPurple scores: 7 culture (now 43) 5 science (now 11) 2 food - consumption: 2 (now 3) 3 resources (now 3) Purple draws 1 military card
210,2020-06-14 05:11:48,Purple,III,13,No Discard Phase
211,2020-06-14 05:11:31,Purple,III,13,Purple upgrades Warrior to SwordsmenPurple spends 1 resource
212,2020-06-14 05:11:20,Purple,III,13,Purple increases populationPurple spends 4 food
213,2020-06-14 05:10:48,Purple,III,13,Purple builds KnightsPurple spends 3 resources
214,2020-06-14 05:10:11,Purple,III,13,Purple increases populationPurple spends 4 food
215,2020-06-14 05:09:26,Purple,III,13,Purple takes Democracy in handPurple uses 2 civil action
216,2020-06-13 22:45:02,Green,III,13,Green colonizes a Inhabited TerritorySacrificed Units: 1 Knights 1 Warrior 1 Warrior Colonization bonus: +1 Total force: 8 Green gets 1 population
217,2020-06-13 22:39:32,Orange,III,13,Green wins Inhabited TerritoryWinning bid is 7
218,2020-06-13 22:39:32,Orange,III,13,Orange passes
219,2020-06-13 22:19:23,Grey,III,13,Grey passes
220,2020-06-13 22:15:11,Green,III,13,Green bids 7
221,2020-06-13 20:46:15,Purple,III,13,Purple passes
222,2020-06-13 19:32:06,Orange,III,13,Orange bids 6
223,2020-06-13 19:28:37,Grey,III,13,Grey bids 5
224,2020-06-13 11:49:06,Green,III,13,Green bids 4
225,2020-06-13 07:00:27,Purple,III,13,Purple bids 3
226,2020-06-13 06:59:57,Purple,III,13,Purple plays eventPurple scores 2 culture Current event: I / Inhabited Territory Increase population by 1
227,2020-06-13 01:26:58,Orange,III,13,End turnOrange scores: 4 culture (now 46) 4 science (now 9) 4 food - consumption: 2 (now 6) 6 resources (now 7) Orange draws 3 military cards
228,2020-06-13 01:26:56,Orange,III,13,No Discard Phase
229,2020-06-13 01:23:48,Orange,III,13,Orange builds KnightsOrange spends 3 resources
230,2020-06-13 01:21:37,Orange,III,13,Orange takes Patriotism in handOrange uses 2 civil action
231,2020-06-13 01:21:31,Orange,III,13,Orange destroys Agriculture
232,2020-06-13 01:21:25,Orange,III,13,Orange upgrades Agriculture to Selective BreedingOrange spends 4 resources
233,2020-06-13 01:21:20,Orange,III,13,Orange upgrades Agriculture to Selective BreedingOrange spends 4 resources
234,2020-06-13 01:21:15,Orange,III,13,Orange discovers Selective Breeding using BreakthroughOrange loses 5 science Orange gets 3 science
235,2020-06-12 19:25:32,Purple,III,13,Purple defends1 Defense card +4 played 1 military card played 1 military card played Purple strength: 18 Orange strength: 18
236,2020-06-12 15:44:24,Orange,III,13,Orange plays Plunder against PurpleYour rival loses a total of up to 5 resource and/or food (your choice). You gain that many resource and food. Orange uses 1 military action
237,2020-06-12 15:43:20,Orange,III,13,Orange wins War over TerritoryAttacker's strength: 18 Defender's strength: 5
238,2020-06-12 15:43:20,Grey,III,12,End turnGrey scores: 5 culture (now 42) 9 science (now 17) 2 food - consumption: 2 (now 7) 3 resources (now 6) Grey draws 1 military card
239,2020-06-12 15:43:19,Grey,III,12,Grey discards 1 card
240,2020-06-12 15:42:55,Grey,III,12,Discard Phase1 military card must be discarded
241,2020-06-12 15:42:42,Grey,III,12,Grey takes Rich Land in handGrey uses 2 civil action
242,2020-06-12 15:42:38,Grey,III,12,Grey takes Wave of Nationalism in handGrey uses 1 civil action
243,2020-06-12 15:42:33,Grey,III,12,Grey takes Efficient Upgrade in handGrey uses 1 civil action
244,2020-06-12 15:42:19,Grey,III,12,Grey adopts existing tacticsI / Fighting Band
245,2020-06-12 15:42:12,Grey,III,12,Grey disbands Swordsmen
246,2020-06-12 15:42:00,Grey,III,12,Grey upgrades Philosophy to Scientific MethodGrey spends 4 resources
247,2020-06-12 15:41:51,Grey,III,12,Grey elects Isaac Newton
248,2020-06-12 15:34:43,Grey,III,12,Grey plays eventGrey scores 2 culture Future events are now current events. Current event: II / Economic Progress Each player produces immediately: Evaluate corruption. Produce food. Evaluate consumption. Produce resources. CORRUPTION! Orange loses 2 resources CORRUPTION! Purple loses 2 resources CORRUPTION! Grey loses 2 resources Orange produces : 0 food - consumption: 3 Orange produces : 4 resources Purple produces : 2 food - consumption: 2 Purple produces : 1 resources Green produces : 2 food - consumption: 2 Green produces : 4 resources Grey produces : 2 food - consumption: 2 Grey produces : 1 resources
249,2020-06-12 11:24:39,Green,III,12,End turnGreen scores: 6 culture (now 33) 4 science (now 5) 2 food - consumption: 2 (now 4) 4 resources (now 4) Green draws 3 military cards
250,2020-06-12 11:24:38,Green,III,12,No Discard Phase
