,time,player,age,round,text
487,2020-06-03 16:55:22,Grey,II,8,Grey builds Warrior Grey spends 2 resources
488,2020-06-03 16:55:13,Grey,II,8,Grey destroys Bronze
489,2020-06-03 16:54:54,Grey,II,8,Grey destroys Bronze
490,2020-06-03 16:54:25,Grey,II,8,Grey discovers Alchemy Grey loses 4 science
491,2020-06-03 16:53:54,Grey,II,8,Grey takes Knights in hand Grey uses 1 civil action
492,2020-06-03 16:48:22,Grey,II,8,Grey plays event Grey scores 1 culture Current event: I / Scientific Breakthrough Each civilization immediately scores science equal to the amount of science it produces. Orange scores 4 science Purple scores 2 science Green scores 2 science Grey scores 2 science
493,2020-06-03 16:47:21,Green,II,8,End turn Green scores: 1 culture (now 6) 2 science (now 7) 1 food - consumption: 1 (now 4) 4 resources (now 8) Green draws 1 military card
494,2020-06-03 16:47:20,Green,II,8,No Discard Phase
495,2020-06-03 16:47:05,Green,II,8,Green plays Cultural Heritage Green gets 2 science Green scores 2 culture
496,2020-06-03 16:46:25,Green,II,8,Green puts Alchemy back in the row Green gets 1 civil action
497,2020-06-03 16:45:14,Green,II,8,Green sets up new tactics I / Legion
498,2020-06-03 16:44:31,Green,II,8,Green takes Alchemy in hand Green uses 1 civil action
499,2020-06-03 16:43:33,Green,II,8,Green builds 1 stage of Great Wall Green spends 2 resources Wonder completed
500,2020-06-03 16:42:36,Green,II,8,Green builds 1 stage of Great Wall Green spends 3 resources
501,2020-06-03 16:42:31,Green,II,8,Green builds 1 stage of Great Wall Green spends 2 resources
502,2020-06-03 16:42:26,Green,II,8,Green builds 1 stage of Great Wall Green spends 2 resources
503,2020-06-03 16:42:04,Green,II,8,Green passes Political Phase
504,2020-06-03 16:41:01,Purple,II,8,End turn Purple scores: CORRUPTION! Purple loses 2 resources 2 culture (now 15) 2 science (now 6) 1 food - consumption: 2 (now 4) 5 resources (now 11) Purple draws 1 military card
505,2020-06-03 16:41:00,Purple,II,8,No Discard Phase
506,2020-06-03 16:40:53,Purple,II,8,Purple takes Swordsmen in hand Purple uses 1 civil action
507,2020-06-03 16:40:50,Purple,II,8,Purple puts Engineering Genius back in the row Purple gets 1 civil action
508,2020-06-03 16:40:34,Purple,II,8,Purple upgrades Agriculture to Irrigation Purple spends 2 resources
509,2020-06-03 16:40:26,Purple,II,8,Purple discovers Irrigation Purple loses 3 science
510,2020-06-03 16:40:17,Purple,II,8,Purple sets up new tactics I / Medieval Army
511,2020-06-03 16:40:10,Purple,II,8,Purple takes Breakthrough in hand Purple uses 1 civil action
512,2020-06-03 16:40:08,Purple,II,8,Purple takes Engineering Genius in hand Purple uses 1 civil action
513,2020-06-03 16:39:53,Purple,II,8,Purple plays event Purple scores 1 culture Current event: I / New Deposits Each civilization produces resources immediately. Ignore corruption. Orange produces 3 resources Purple produces 5 resources Green produces 4 resources Grey produces 5 resources
514,2020-06-03 16:38:31,Orange,I,8,End turn Orange scores: 4 culture (now 22) 4 science (now 12) 1 food - consumption: 1 (now 2) 3 resources (now 6) Orange draws 1 military card
515,2020-06-03 16:38:30,Orange,I,8,No Discard Phase
516,2020-06-03 16:37:54,Orange,I,8,Orange increases population Orange spends 3 food
517,2020-06-03 16:37:25,Orange,I,8,Orange elects Leonardo Da Vinci Aristotle dies Orange gets 1 civil action
518,2020-06-03 16:37:13,Orange,I,8,Orange takes Leonardo Da Vinci in hand Orange uses 2 civil action
519,2020-06-03 16:36:57,Orange,I,8,Orange takes Alchemy in hand Orange uses 1 civil action
520,2020-06-03 16:33:44,Purple,I,8,Purple defends 1 Defense card +2 played 1 military card played Purple strength: 9 Orange strength: 9
521,2020-06-03 16:33:12,Orange,I,8,Orange plays Enslave against Purple Your rival loses 1 population. You gain 2 food and 2 resources. Orange uses 2 military action
522,2020-06-03 16:31:39,Grey,I,7,End turn Genghis Khan scores 0 culture. Grey scores: 1 culture (now 9) 2 science (now 2) 1 food - consumption: 1 (now 2) 5 resources (now 9) Grey draws 2 military cards
523,2020-06-03 16:31:38,Grey,I,7,Grey discards 1 card
524,2020-06-03 16:31:17,Grey,I,7,Discard Phase 1 military card must be discarded
525,2020-06-03 16:30:57,Grey,I,7,Grey upgrades Bronze to Iron using Rich Land Grey spends 1 resource
526,2020-06-03 16:30:36,Grey,I,7,Grey discovers Iron Grey loses 5 science
527,2020-06-03 16:29:55,Grey,I,7,Grey puts Swordsmen back in the row Grey gets 2 civil action
528,2020-06-03 16:29:03,Grey,I,7,Grey sets up new tactics I / Medieval Army
529,2020-06-03 16:28:52,Grey,I,7,Grey takes Swordsmen in hand Grey uses 2 civil action
530,2020-06-03 16:28:41,Grey,I,7,Grey elects Genghis Khan
531,2020-06-03 16:28:22,Grey,I,7,Grey takes Iron in hand Grey uses 2 civil action
532,2020-06-03 16:14:56,Grey,I,7,Alexander dies after building his great Empire Grey gets 1 yellow token
533,2020-06-03 15:32:42,Green,I,7,End turn Green scores: 0 culture (now 3) 2 science (now 3) 1 food - consumption: 1 (now 3) 4 resources (now 9) Green draws 1 military card
534,2020-06-03 15:32:41,Green,I,7,Green discards 3 cards
535,2020-06-03 15:32:30,Green,I,7,Discard Phase 3 military cards must be discarded
536,2020-06-03 15:31:56,Green,I,7,Green takes Irrigation in hand Green uses 1 civil action
537,2020-06-03 15:31:52,Green,I,7,Green puts Irrigation back in the row Green gets 1 civil action
538,2020-06-03 15:30:35,Green,I,7,Barbarossa enlists a Warrior Green spends 2 food Green spends 1 resource
539,2020-06-03 15:30:27,Green,I,7,Green takes Irrigation in hand Green uses 1 civil action
540,2020-06-03 15:30:09,Green,I,7,Green discovers Code of Laws Green loses 6 science
541,2020-06-03 15:30:01,Green,I,7,Green takes Great Wall in hand Green uses 3 civil action
542,2020-06-03 15:29:54,Green,I,7,Green passes Political Phase
543,2020-06-03 15:29:30,Purple,I,7,End turn Purple scores: 2 culture (now 12) 2 science (now 7) 1 food - consumption: 1 (now 3) 5 resources (now 5) Purple draws 2 military cards
544,2020-06-03 15:29:29,Purple,I,7,No Discard Phase
545,2020-06-03 15:29:14,Purple,I,7,Purple upgrades Bronze to Iron Purple spends 3 resources
546,2020-06-03 15:28:45,Purple,I,7,Purple builds Knights Purple loses 2 military resource Purple spends 1 resource
547,2020-06-03 15:28:38,Purple,I,7,Purple plays Patriotism Purple gets 2 military resource Purple gets 1 military action
548,2020-06-03 15:28:24,Purple,I,7,Purple takes Urban Growth in hand Purple uses 1 civil action
549,2020-06-03 15:28:19,Purple,I,7,Purple increases population Purple spends 3 food
550,2020-06-03 15:27:34,Purple,I,7,Purple passes Political Phase
551,2020-06-03 15:27:05,Orange,I,7,End turn Orange scores: 4 culture (now 18) 3 science (now 7) 1 food - consumption: 1 (now 4) 3 resources (now 3)
552,2020-06-03 15:27:02,Orange,I,7,No Discard Phase
553,2020-06-03 15:26:37,Orange,I,7,Orange builds Warrior Orange spends 2 resources
554,2020-06-03 15:26:26,Orange,I,7,Orange upgrades Warrior to Swordsmen Orange spends 1 resource
555,2020-06-03 15:26:19,Orange,I,7,Orange upgrades Warrior to Swordsmen Orange spends 1 resource
556,2020-06-03 15:26:07,Orange,I,7,Orange discovers Swordsmen Orange loses 4 science
557,2020-06-03 15:25:54,Orange,I,7,Orange increases population Orange spends 3 food
558,2020-06-03 15:25:39,Orange,I,7,Orange takes Swordsmen in hand Orange uses 2 civil action
559,2020-06-03 15:23:53,Green,I,7,Green colonizes a Strategic Territory Sacrificed Units: 1 Warrior Colonization bonus: +3 Total force: 4 Green draws 3 military cards
560,2020-06-03 15:23:29,Purple,I,7,Green wins Strategic Territory Winning bid is 4
561,2020-06-03 15:23:29,Purple,I,7,Purple passes
562,2020-06-03 15:23:08,Orange,I,7,Orange passes
563,2020-06-03 15:22:30,Grey,I,7,Grey passes
564,2020-06-03 15:21:54,Green,I,7,Green bids 4
565,2020-06-03 15:19:07,Purple,I,7,Purple bids 2
566,2020-06-03 15:17:36,Orange,I,7,Orange bids 1
567,2020-06-03 15:17:15,Orange,I,7,Orange plays event Orange scores 1 culture Future events are now current events. Current event: I / Strategic Territory 3 military cards
568,2020-06-03 15:13:40,Grey,I,6,End turn Grey scores: 1 culture (now 8) 2 science (now 5) 1 food - consumption: 1 (now 1) 4 resources (now 5) Grey draws 2 military cards
569,2020-06-03 15:13:38,Grey,I,6,Grey discards 2 cards
570,2020-06-03 15:13:19,Grey,I,6,Discard Phase 2 military cards must be discarded
571,2020-06-03 15:12:29,Grey,I,6,Grey builds Bronze using Rich Land Grey spends 1 resource
572,2020-06-03 15:12:10,Grey,I,6,Grey increases population Grey spends 3 food
573,2020-06-03 15:12:02,Grey,I,6,Grey builds Warrior Grey spends 2 resources
574,2020-06-03 15:11:54,Grey,I,6,Grey takes Rich Land in hand Grey uses 1 civil action
575,2020-06-03 15:11:51,Grey,I,6,Grey takes Genghis Khan in hand Grey uses 1 civil action
576,2020-06-03 15:11:46,Grey,I,6,Grey plays Stockpile Grey produces 1 food Grey produces 1 resource
577,2020-06-03 15:11:17,Green,I,6,Green colonizes a Developed Territory Sacrificed Units: 1 Warrior Colonization bonus: +3 Total force: 4 Green gets 3 science
578,2020-06-03 15:10:55,Grey,I,6,Green wins Developed Territory Winning bid is 4
579,2020-06-03 15:10:55,Grey,I,6,Grey passes
580,2020-06-03 15:10:11,Green,I,6,Green bids 4
581,2020-06-03 15:09:35,Purple,I,6,Purple passes
582,2020-06-03 15:08:54,Orange,I,6,Orange passes
583,2020-06-03 15:07:27,Grey,I,6,Grey bids 1
584,2020-06-03 15:07:16,Grey,I,6,Grey plays event Grey scores 1 culture Current event: I / Developed Territory 3 science
585,2020-06-03 15:05:51,Green,I,6,End turn Green scores: 0 culture (now 3) 2 science (now 4) 1 food - consumption: 1 (now 4) 4 resources (now 6)
586,2020-06-03 15:05:50,Green,I,6,Green discards 1 card
587,2020-06-03 15:05:41,Green,I,6,Discard Phase 1 military card must be discarded
588,2020-06-03 15:05:33,Green,I,6,Green takes Cultural Heritage in hand Green uses 2 civil action
589,2020-06-03 15:03:15,Green,I,6,Barbarossa enlists a Warrior Green spends 2 food Green spends 1 resource
590,2020-06-03 15:02:30,Green,I,6,Barbarossa enlists a Warrior Green spends 2 food Green spends 1 resource
591,2020-06-03 15:02:03,Green,I,6,Green discovers Cartography Green loses 4 science
592,2020-06-03 15:01:54,Green,I,6,Green takes Cartography in hand Green uses 1 civil action
593,2020-06-03 15:01:45,Green,I,6,Green plays event Green scores 1 culture Current event: I / Good Harvest Each civilization produces food immediately. Ignore corruption and consumption. Orange produces 2 food Purple produces 2 food Green produces 2 food Grey produces 2 food
594,2020-06-03 15:01:18,Purple,I,6,End turn Purple scores: 2 culture (now 10) 2 science (now 5) 1 food - consumption: 1 (now 3) 4 resources (now 4)
595,2020-06-03 15:01:17,Purple,I,6,No Discard Phase
596,2020-06-03 15:01:02,Purple,I,6,Purple builds Warrior Purple spends 2 resources
597,2020-06-03 15:00:52,Purple,I,6,Purple upgrades Bronze to Iron using Rich Land Purple spends 1 resource
598,2020-06-03 15:00:36,Purple,I,6,Purple discovers Iron Purple loses 5 science
599,2020-06-03 15:00:12,Purple,I,6,Purple takes Iron in hand Purple uses 3 civil action
600,2020-06-03 15:00:04,Purple,I,6,Purple spends 1 food Purple spends 1 resource
601,2020-06-03 14:58:06,Grey,I,6,Grey spends 2 food
602,2020-06-03 14:55:37,Purple,I,6,Purple plays event Purple scores 1 culture Current event: I / Raiders Each of the two weakest civilizations lose a total of 2 resources and/or food. Grey and Purple each lose 2 resources and/or food Grey choses first
603,2020-06-03 14:51:36,Orange,I,6,End turn Orange scores: 4 culture (now 13) 3 science (now 7) 1 food - consumption: 1 (now 4) 3 resources (now 4) Orange draws 3 military cards
604,2020-06-03 14:51:34,Orange,I,6,No Discard Phase
605,2020-06-03 14:50:55,Orange,I,6,Orange builds Printing Press using Urban Growth Orange spends 2 resources
606,2020-06-03 14:50:43,Orange,I,6,Orange takes Masonry in hand Orange uses 1 civil action
607,2020-06-03 14:50:23,Orange,I,6,Orange increases population Orange spends 2 food
608,2020-06-03 14:50:15,Orange,I,6,Orange discovers Printing Press Orange loses 3 science
609,2020-06-03 14:49:56,Orange,I,6,Orange passes Political Phase
610,2020-06-03 14:45:44,Grey,I,5,End turn Grey scores: 1 culture (now 6) 2 science (now 3) 1 food - consumption: 1 (now 2) 3 resources (now 3) Grey draws 3 military cards
611,2020-06-03 14:45:41,Grey,I,5,No Discard Phase
612,2020-06-03 14:45:16,Grey,I,5,Grey takes Urban Growth in hand Grey uses 1 civil action
613,2020-06-03 14:45:04,Grey,I,5,Grey discovers Warfare Grey loses 5 science
614,2020-06-03 14:44:56,Grey,I,5,Grey takes Warfare in hand Grey uses 1 civil action
615,2020-06-03 14:44:46,Grey,I,5,Grey builds Bread & Circuses Grey spends 3 resources
616,2020-06-03 14:44:38,Grey,I,5,Grey discovers Bread & Circuses Grey loses 3 science
617,2020-06-03 14:44:29,Grey,I,5,Grey plays event Grey scores 1 culture Current event: I / Cultural Influence Each civilization immediately scores culture equal to the amount of culture it produces. Orange scores 3 culture Purple scores 2 culture Green scores 0 culture Grey scores 1 culture
618,2020-06-03 14:36:31,Green,I,5,End turn Green scores: 0 culture (now 2) 2 science (now 6) 1 food - consumption: 1 (now 5) 4 resources (now 4) Green draws 2 military cards
619,2020-06-03 14:36:30,Green,I,5,Green discards 1 card
620,2020-06-03 14:36:19,Green,I,5,Discard Phase 1 military card must be discarded
621,2020-06-03 14:35:40,Green,I,5,Green elects Frederick Barbarossa Homer dies
622,2020-06-03 14:35:32,Green,I,5,Green takes Frederick Barbarossa in hand Green uses 1 civil action
623,2020-06-03 14:34:35,Green,I,5,Green builds 1 stage of Colossus Green spends 3 resources Wonder completed
624,2020-06-03 14:34:28,Green,I,5,Green builds 1 stage of Colossus Green spends 3 resources
625,2020-06-03 14:33:33,Green,I,5,Green passes Political Phase
626,2020-06-03 14:31:46,Purple,I,5,End turn Purple scores: 2 culture (now 5) 2 science (now 8) 1 food - consumption: 1 (now 3) 3 resources (now 4) Purple draws 1 military card
627,2020-06-03 14:31:44,Purple,I,5,No Discard Phase
628,2020-06-03 14:31:33,Purple,I,5,Purple takes Irrigation in hand Purple uses 1 civil action
629,2020-06-03 14:30:35,Purple,I,5,Purple plays Frugality Purple increases population Purple spends 3 food Purple produces 1 food
630,2020-06-03 14:30:19,Purple,I,5,Purple builds Knights Purple spends 3 resources
631,2020-06-03 14:30:02,Purple,I,5,Purple takes Patriotism in hand Purple uses 1 civil action
632,2020-06-03 14:29:40,Purple,I,5,Purple discovers Knights using Breakthrough Purple loses 5 science Purple gets 2 science
633,2020-06-03 14:28:57,Purple,I,5,Purple passes Political Phase
634,2020-06-03 14:24:10,Orange,I,5,End turn Orange scores: 3 culture (now 6) 2 science (now 6) 2 food - consumption: 0 (now 5) 3 resources (now 3)
635,2020-06-03 14:24:09,Orange,I,5,No Discard Phase
636,2020-06-03 14:23:54,Orange,I,5,Orange sets up new tactics I / Legion
637,2020-06-03 14:22:05,Orange,I,5,Orange builds Warrior Orange spends 2 resources
638,2020-06-03 14:21:59,Orange,I,5,Orange builds Warrior Orange spends 2 resources
639,2020-06-03 14:21:49,Orange,I,5,Orange increases population Orange spends 2 food
640,2020-06-03 14:21:39,Orange,I,5,Orange discovers Theocracy Orange loses 6 science
641,2020-06-03 14:20:17,Orange,I,5,Orange takes Theocracy in hand Orange uses 1 civil action
642,2020-06-03 14:20:09,Orange,I,5,Orange elects Aristotle
643,2020-06-03 14:19:57,Orange,I,5,Orange passes Political Phase
644,2020-06-03 14:19:20,Grey,I,4,End turn Grey scores: 1 culture (now 3) 2 science (now 9) 1 food - consumption: 1 (now 1) 3 resources (now 3) Grey draws 2 military cards
645,2020-06-03 14:19:16,Grey,I,4,No Discard Phase
646,2020-06-03 14:19:02,Grey,I,4,Grey takes Alchemy in hand Grey uses 1 civil action
647,2020-06-03 14:18:53,Grey,I,4,Grey increases population Grey spends 3 food
648,2020-06-03 14:18:36,Grey,I,4,Grey increases population Grey spends 3 food
649,2020-06-03 14:18:27,Grey,I,4,Grey builds 1 stage of Pyramids Grey spends 1 resource Wonder completed
650,2020-06-03 14:18:21,Grey,I,4,Grey builds 1 stage of Pyramids Grey spends 2 resources
651,2020-06-03 14:16:48,Orange,I,4,Orange colonizes a Inhabited Territory Sacrificed Units: 1 Warrior 1 Warrior Total force: 2 Orange gets 1 population
652,2020-06-03 14:16:12,Grey,I,4,Orange wins Inhabited Territory Winning bid is 2
653,2020-06-03 14:16:12,Grey,I,4,Grey passes
654,2020-06-03 14:09:39,Green,I,4,Green passes
655,2020-06-03 14:08:22,Purple,I,4,Purple passes
656,2020-06-03 14:05:24,Orange,I,4,Orange bids 2
657,2020-06-03 13:54:50,Grey,I,4,Grey bids 1
658,2020-06-03 13:53:58,Grey,I,4,Grey plays event Grey scores 1 culture Current event: I / Inhabited Territory Increase population by 1
659,2020-06-03 13:52:56,Green,I,4,End turn Green scores: 0 culture (now 2) 2 science (now 4) 1 food - consumption: 1 (now 4) 4 resources (now 6) Green draws 2 military cards
660,2020-06-03 13:52:55,Green,I,4,No Discard Phase
661,2020-06-03 13:51:37,Green,I,4,Green increases population Green spends 3 food
662,2020-06-03 13:51:27,Green,I,4,Green takes Code of Laws in hand Green uses 1 civil action
663,2020-06-03 13:51:23,Green,I,4,Green upgrades Bronze to Iron Green spends 3 resources
664,2020-06-03 13:51:09,Green,I,4,Green discovers Iron Green loses 5 science
665,2020-06-03 13:45:46,Purple,I,4,Purple builds Religion
666,2020-06-03 13:45:26,Orange,I,4,Orange builds Religion
667,2020-06-03 13:45:04,Grey,I,4,Grey builds Religion
668,2020-06-03 13:44:31,Green,I,4,Green plays event Green scores 1 culture Future events are now current events. Current event: A / Development of Religion Each player with an unused worker may immediately build an Age A temple for free.
669,2020-06-03 13:44:15,Purple,I,4,End turn Purple scores: 1 culture (now 3) 2 science (now 9) 1 food - consumption: 1 (now 4) 3 resources (now 4) Purple draws 1 military card
670,2020-06-03 13:44:14,Purple,I,4,No Discard Phase
671,2020-06-03 13:44:05,Purple,I,4,Purple takes Rich Land in hand Purple uses 1 military action
672,2020-06-03 13:43:57,Purple,I,4,Purple increases population Purple spends 3 food
673,2020-06-03 13:43:39,Purple,I,4,Purple builds 1 stage of Hanging Gardens Purple spends 2 resources Wonder completed
674,2020-06-03 13:43:31,Purple,I,4,Purple builds 1 stage of Hanging Gardens Purple spends 2 resources
675,2020-06-03 13:43:22,Purple,I,4,Purple builds 1 stage of Hanging Gardens Purple spends 2 resources
676,2020-06-03 13:42:58,Purple,I,4,Purple plays event Purple scores 1 culture Current event: A / Development of Agriculture Each civilization gains 2 food. Orange produces 2 food Purple produces 2 food Green produces 2 food Grey produces 2 food
677,2020-06-03 13:42:39,Orange,I,4,End turn Orange scores: 1 culture (now 3) 2 science (now 9) 1 food - consumption: 1 (now 3) 3 resources (now 4)
678,2020-06-03 13:42:38,Orange,I,4,No Discard Phase
679,2020-06-03 13:41:58,Orange,I,4,Orange builds Warrior Orange spends 2 resources
680,2020-06-03 13:41:52,Orange,I,4,Orange builds Warrior Orange spends 2 resources
681,2020-06-03 13:41:45,Orange,I,4,Orange increases population Orange spends 3 food
682,2020-06-03 13:41:28,Orange,I,4,Orange takes Printing Press in hand Orange uses 1 civil action
683,2020-06-03 13:41:08,Orange,I,4,Orange takes Universitas Carolina in hand Orange uses 2 civil action
684,2020-06-03 13:41:02,Orange,I,4,Orange passes Political Phase
685,2020-06-03 13:40:16,Grey,I,3,End turn Grey scores: 0 culture (now 1) 2 science (now 7) 1 food - consumption: 1 (now 4) 3 resources (now 3) Grey draws 2 military cards
686,2020-06-03 13:40:14,Grey,I,3,No Discard Phase
687,2020-06-03 13:40:00,Grey,I,3,Grey takes Bread & Circuses in hand Grey uses 1 civil action
688,2020-06-03 13:38:49,Grey,I,3,Grey builds 1 stage of Pyramids Grey spends 3 resources
689,2020-06-03 13:38:42,Grey,I,3,Grey elects Alexander the Great
690,2020-06-03 13:38:33,Grey,I,3,Grey builds Philosophy Grey spends 3 resources
691,2020-06-03 13:38:18,Grey,I,3,Grey plays event Grey scores 1 culture Current event: A / Development of Trade Routes Each civilization scores 1 science and gains 1 resource and 1 food.
692,2020-06-03 13:35:54,Green,I,3,End turn Green scores: 0 culture (now 1) 2 science (now 6) 1 food - consumption: 1 (now 3) 3 resources (now 4) Green draws 1 military card
693,2020-06-03 13:35:53,Green,I,3,No Discard Phase
694,2020-06-03 13:35:44,Green,I,3,Green builds Warrior Green loses 1 military resource Green spends 1 resource
695,2020-06-03 13:34:58,Green,I,3,Green takes Iron in hand Green uses 2 civil action
696,2020-06-03 13:32:45,Green,I,3,Green builds Philosophy Green spends 3 resources
697,2020-06-03 13:32:21,Green,I,3,Green elects Homer
698,2020-06-03 13:32:10,Green,I,3,Green plays event Green scores 1 culture Current event: A / Development of Science Each civilization scores 2 science.
699,2020-06-03 13:31:18,Purple,I,3,End turn Purple scores: 0 culture (now 1) 2 science (now 4) 1 food - consumption: 1 (now 3) 3 resources (now 6) Purple draws 2 military cards
700,2020-06-03 13:31:16,Purple,I,3,No Discard Phase
701,2020-06-03 13:31:03,Purple,I,3,Purple takes Knights in hand Purple uses 1 civil action
702,2020-06-03 13:30:56,Purple,I,3,Purple takes Breakthrough in hand Purple uses 2 civil action
703,2020-06-03 13:30:20,Purple,I,3,Purple thought he could play the card Frugality Not enough food
704,2020-06-03 13:30:09,Purple,I,3,Purple builds Philosophy using Urban Growth Purple spends 2 resources
705,2020-06-03 13:29:20,Purple,I,3,Purple plays event Purple scores 1 culture Current event: A / Development of Settlement Each civilization gains 1 population.
706,2020-06-03 13:28:49,Orange,I,3,End turn Orange scores: 1 culture (now 2) 2 science (now 4) 2 food - consumption: 0 (now 4) 3 resources (now 4) Orange draws 2 military cards
707,2020-06-03 13:28:48,Orange,I,3,No Discard Phase
708,2020-06-03 13:28:31,Orange,I,3,Orange builds 1 stage of Library of Alexandria Orange spends 1 resource Wonder completed
709,2020-06-03 13:28:25,Orange,I,3,Orange plays Engineering Genius Orange builds 1 stage of Library of Alexandria Orange spends 2 resources
710,2020-06-03 13:28:18,Orange,I,3,Orange builds 1 stage of Library of Alexandria Orange spends 1 resource
711,2020-06-03 13:28:09,Orange,I,3,Orange takes Aristotle in hand Orange uses 1 civil action
712,2020-06-03 13:23:59,Orange,I,3,Orange plays event Orange scores 1 culture Current event: A / Development of Crafts Each civilization gains 2 resources. Orange produces 2 resources Purple produces 2 resources Green produces 2 resources Grey produces 2 resources
713,2020-06-03 13:22:52,Grey,I,2,End turn Grey scores: 0 culture (now 0) 1 science (now 2) 2 food - consumption: 0 (now 2) 3 resources (now 3) Grey draws 2 military cards
714,2020-06-03 13:22:51,Grey,I,2,No Discard Phase
715,2020-06-03 13:22:43,Grey,I,2,Grey takes Rich Land in hand Grey uses 1 civil action
716,2020-06-03 13:22:38,Grey,I,2,Grey takes Stockpile in hand Grey uses 1 civil action
717,2020-06-03 13:22:27,Grey,I,2,Grey builds Bronze Grey spends 2 resources
718,2020-06-03 13:22:20,Grey,I,2,Grey increases population Grey spends 2 food
719,2020-06-03 13:21:26,Grey,I,2,Action Phase begins
720,2020-06-03 13:21:26,Green,I,2,End turn Green scores: 0 culture (now 0) 1 science (now 2) 2 food - consumption: 0 (now 2) 3 resources (now 3) Green draws 2 military cards
721,2020-06-03 13:21:25,Green,I,2,No Discard Phase
722,2020-06-03 13:20:43,Green,I,2,Green takes Knights in hand Green uses 2 civil action
723,2020-06-03 13:20:24,Green,I,2,Green increases population Green spends 2 food
724,2020-06-03 13:20:14,Green,I,2,Green builds Bronze Green spends 2 resources
725,2020-06-03 13:17:40,Green,I,2,Action Phase begins
726,2020-06-03 13:17:40,Purple,I,2,End turn Purple scores: 0 culture (now 0) 1 science (now 2) 2 food - consumption: 0 (now 2) 3 resources (now 3) Purple draws 1 military card
727,2020-06-03 13:17:39,Purple,I,2,No Discard Phase
728,2020-06-03 13:17:28,Purple,I,2,Purple increases population Purple spends 2 food
729,2020-06-03 13:17:21,Purple,I,2,Purple elects Hammurabi
730,2020-06-03 13:17:12,Purple,I,2,Purple builds Bronze Purple spends 2 resources
731,2020-06-03 13:17:01,Purple,I,2,Purple takes Frugality in hand Purple uses 1 civil action
732,2020-06-03 13:16:56,Purple,I,2,Purple takes Hanging Gardens in hand Purple uses 1 civil action
733,2020-06-03 13:16:08,Purple,I,2,Action Phase begins
734,2020-06-03 13:16:08,Orange,I,2,End turn Orange scores: 0 culture (now 0) 1 science (now 2) 2 food - consumption: 0 (now 2) 3 resources (now 3) Orange draws 2 military cards
735,2020-06-03 13:16:05,Orange,I,2,No Discard Phase
736,2020-06-03 13:15:40,Orange,I,2,Orange takes Urban Growth in hand Orange uses 1 civil action
737,2020-06-03 13:15:35,Orange,I,2,Orange takes Engineering Genius in hand Orange uses 1 civil action
738,2020-06-03 13:15:30,Orange,I,2,Orange builds Bronze Orange spends 2 resources
739,2020-06-03 13:15:22,Orange,I,2,Orange increases population Orange spends 2 food
740,2020-06-03 13:13:35,Orange,I,2,Action Phase begins
741,2020-06-03 13:13:34,Grey,A,1,End turn Grey scores: 0 culture (now 0) 1 science (now 1) 2 food - consumption: 0 (now 2) 2 resources (now 2)
742,2020-06-03 13:13:32,Grey,A,1,No Discard Phase
743,2020-06-03 13:13:27,Grey,A,1,Grey takes Pyramids in hand Grey uses 2 civil action
744,2020-06-03 13:13:20,Grey,A,1,Grey takes Alexander the Great in hand Grey uses 2 civil action
745,2020-06-03 13:11:23,Grey,A,1,Action Phase begins
746,2020-06-03 13:11:23,Green,A,1,End turn Green scores: 0 culture (now 0) 1 science (now 1) 2 food - consumption: 0 (now 2) 2 resources (now 2)
747,2020-06-03 13:11:22,Green,A,1,No Discard Phase
748,2020-06-03 13:06:37,Green,A,1,Green takes Colossus in hand Green uses 2 civil action
749,2020-06-03 13:06:19,Green,A,1,Green takes Homer in hand Green uses 1 civil action
750,2020-06-03 13:05:46,Green,A,1,Action Phase begins
