,time,player,age,round,text
0,2020-11-01 08:54:35,Orange,IV,21,End of game Check the journal to get the final impacts effects : Impact of Industry Impact of Happiness Impact of Government Impact of Architecture Impact of Politicians WINNER IS MICAH YOSPE AS PURPLE (209 PTS) 2nd is David Li as Orange (197 pts) 3rd is X L as Green (180 pts) 4th is teddy yeh as Grey (146 pts)
1,2020-11-01 08:54:35,Grey,IV,21,Sagrada Familia scoring Green scores 8 culture
2,2020-11-01 08:54:35,Grey,IV,21,Impact of Politicians Each civilization loses 2 culture for each empty slot on its blue bank. Orange loses 16 culture Purple loses 2 culture Green loses 8 culture Grey loses 4 culture
3,2020-11-01 08:54:35,Grey,IV,21,Impact of Architecture Each civilization scores 1 culture per level of its urban buildings. Orange scores 12 culture Purple scores 8 culture Green scores 0 culture Grey scores 14 culture
4,2020-11-01 08:54:35,Grey,IV,21,Impact of Government Each civilization scores 2 culture per civil action and 1 culture per military action. Orange scores 18 culture Purple scores 19 culture Green scores 19 culture Grey scores 19 culture
5,2020-11-01 08:54:35,Grey,IV,21,Impact of Happiness Each civilization scores 2 culture per happy face (max 16) and loses 2 per discontent worker. Orange scores 16 culture Purple scores 16 culture Green scores 6 culture Grey scores 16 culture
6,2020-11-01 08:54:35,Grey,IV,21,Impact of Industry Each civilization scores culture equal to the amount of resources it produce. Orange scores 8 culture Purple scores 0 culture Green scores 0 culture Grey scores 2 culture
7,2020-11-01 08:54:35,Grey,IV,21,End turn Grey scores: 3 food - consumption: 3 (now 5) 2 resources (now 2) 21 culture (now 99) 8 science (now 9)
8,2020-11-01 08:54:14,Grey,IV,20,Grey destroys Iron
9,2020-11-01 08:54:05,Grey,IV,20,Grey destroys Iron
10,2020-11-01 08:53:51,Grey,IV,20,Grey upgrades Religion to Theology using Efficient Upgrade
11,2020-11-01 08:53:40,Grey,IV,20,Grey builds Religion Grey spends 3 resources
12,2020-11-01 08:53:09,Grey,IV,20,Grey increases population Grey spends 5 food
13,2020-11-01 08:52:58,Grey,IV,20,Grey builds 2 stages of First Space Flight Grey spends 13 resources Wonder completed Grey scores 21 culture
14,2020-11-01 08:52:50,Grey,IV,20,Grey plays Mineral Deposits Grey produces 4 resources
15,2020-11-01 08:52:33,Grey,IV,20,Grey discovers Democracy 21 science spent
16,2020-11-01 08:52:03,Grey,IV,20,No Discard Phase
17,2020-11-01 08:52:03,Grey,IV,20,Grey passes Political Phase
18,2020-11-01 00:21:16,Green,IV,20,End turn Green scores: -1 food - consumption: 1 (now 1) 0 resources (now 0) 8 culture (now 155) 0 science (now 0)
19,2020-11-01 00:17:46,Green,IV,20,Green takes Professional Sports in hand 1 civil action used
20,2020-11-01 00:14:50,Green,IV,20,Green builds Warrior Green spends 2 resources
21,2020-11-01 00:14:38,Green,IV,20,Green destroys Selective breeding
22,2020-11-01 00:12:54,Green,IV,20,Green destroys Iron
23,2020-11-01 00:12:44,Green,IV,20,Green destroys Iron
24,2020-11-01 00:12:08,Green,IV,20,Green builds 1 stage of Sagrada Familia Green spends 4 resources
25,2020-11-01 00:11:59,Green,IV,20,Green plays Engineering Genius Green builds 1 stage of Sagrada Familia
26,2020-11-01 00:11:49,Green,IV,20,Green plays Endowment for the Arts
27,2020-10-31 21:19:54,Green,IV,20,No Discard Phase
28,2020-10-31 21:19:54,Grey,IV,20,Grey defends 1 Defense card +6 played Grey strength: 6 Green strength: 5
29,2020-10-31 20:50:17,Green,IV,20,Green plays Armed Intervention against Grey A rival loses 7 culture. You score 7 culture. 2 military actions used
30,2020-10-31 19:01:40,Purple,IV,20,End turn Purple scores: 1 food - consumption: 3 (now 5) 0 resources (now 0) 20 culture (now 168) 1 science (now 7)
31,2020-10-31 19:01:30,Purple,IV,20,Purple destroys Coal
32,2020-10-31 19:01:22,Purple,IV,20,Purple destroys Coal
33,2020-10-31 19:01:13,Purple,IV,20,Purple builds Printing Press Purple spends 3 resources
34,2020-10-31 19:01:04,Purple,IV,20,Purple elects John Paul II
35,2020-10-31 19:00:49,Purple,IV,20,Purple builds Organized religion Purple spends 5 resources
36,2020-10-31 19:00:42,Purple,IV,20,Purple takes John Paul II in hand 2 civil actions used
37,2020-10-31 18:58:33,Purple,IV,20,No Discard Phase
38,2020-10-31 18:58:33,Purple,IV,20,Purple colonizes a Inhabited Territory Sacrificed Units: 1 Knights 1 Colonization card +3 Total force: 5 Purple increases population by 2
39,2020-10-31 18:48:20,Orange,IV,20,Purple wins Inhabited Territory Winning bid is 5
40,2020-10-31 18:48:20,Orange,IV,20,Orange passes
41,2020-10-31 18:35:02,Purple,IV,20,Purple bids 5
42,2020-10-31 18:34:19,Purple,IV,20,Purple plays event Purple scores 3 culture Future events are now current events. Current event: II / Inhabited Territory 2 population
43,2020-10-31 18:25:07,Orange,IV,20,End turn Orange scores: 2 food - consumption: 4 (now 4) 8 resources (now 16) 22 culture (now 159) 8 science (now 8)
44,2020-10-31 18:24:41,Orange,IV,20,Orange takes Democracy in hand 1 civil action used
45,2020-10-31 18:24:37,Orange,IV,20,Orange puts Tanks back in the row 1 civil action recovered
46,2020-10-31 18:24:34,Orange,IV,20,Orange takes Tanks in hand 1 civil action used
47,2020-10-31 18:24:21,Orange,IV,20,Orange puts Tanks back in the row 1 civil action recovered
48,2020-10-31 18:24:18,Orange,IV,20,Orange takes Tanks in hand 1 civil action used
49,2020-10-31 18:06:16,Orange,IV,20,Orange builds Modern Infantry Orange spends 3 resources
50,2020-10-31 18:06:11,Orange,IV,20,Orange plays Patriotism
51,2020-10-31 18:05:50,Orange,IV,20,Orange increases population Orange spends 7 food
52,2020-10-31 18:05:44,Orange,IV,20,Orange discovers Modern Infantry 8 science spent
53,2020-10-31 18:05:37,Orange,IV,20,Orange discovers Satellites 8 science spent
54,2020-10-31 18:05:30,Orange,IV,20,Orange takes Satellites in hand 2 civil actions used
55,2020-10-31 18:05:26,Orange,IV,20,Action Phase begins
56,2020-10-31 18:05:26,Orange,IV,20,Orange discards 1 cards
57,2020-10-31 17:58:52,Orange,IV,20,Discard Phase 1 military card must be discarded
58,2020-10-31 17:58:52,Orange,IV,20,"Orange plays event Orange scores 3 culture Current event: II / Emigration Each civilization loses half of its discontent workers, rounded up (return to yellow bank)."
59,2020-10-31 17:50:58,Grey,IV,20,Last turn Game ends at the end of the starting round Units may no longer be sacrificed
60,2020-10-31 17:50:58,Grey,IV,20,End turn Grey scores: 3 food - consumption: 3 (now 7) 6 resources (now 12) 18 culture (now 57) 8 science (now 22)
61,2020-10-31 17:50:58,Grey,IV,20,Last turn Game ends at the end of the starting round Units may no longer be sacrificed
62,2020-10-31 17:50:47,Grey,IV,19,Grey takes Democracy in hand 1 civil action used
63,2020-10-31 17:50:09,Grey,IV,19,Grey puts Democracy back in the row 1 civil action recovered
64,2020-10-31 17:50:02,Grey,IV,19,Grey takes Democracy in hand 1 civil action used
65,2020-10-31 17:49:36,Grey,IV,19,Grey elects Elvis Presley
66,2020-10-31 17:49:29,Grey,IV,19,Grey takes Elvis Presley in hand 3 civil actions used
67,2020-10-31 17:49:17,Grey,IV,19,Grey builds Journalism using Ideal Building Site Grey spends 2 resources
68,2020-10-31 17:49:02,Grey,IV,19,Grey increases population Grey spends 4 food
69,2020-10-31 17:48:50,Grey,IV,19,No Discard Phase
70,2020-10-31 17:48:50,Grey,IV,19,Grey passes Political Phase
71,2020-10-31 09:34:22,Green,IV,19,End turn Green scores: 2 food - consumption: 2 (now 2) 4 resources (now 6) Green draws 1 military card 8 culture (now 116) 0 science (now 0) Age IV begins. Each player loses 2 yellow tokens John Amos Comenius dies. Isaac Newton dies. International Trade Agreement expires.
72,2020-10-31 09:33:31,Green,III,19,Green takes Computers in hand 1 civil action used
73,2020-10-31 09:33:28,Green,III,19,Green puts Democracy back in the row 1 civil action recovered
74,2020-10-31 09:33:11,Green,III,19,Green takes Democracy in hand 1 civil action used
75,2020-10-31 09:31:32,Green,III,19,Green builds Riflemen Green spends 3 resources
76,2020-10-31 09:31:26,Green,III,19,Green builds Cannon Green spends 3 resources
77,2020-10-31 09:31:20,Green,III,19,Green builds Riflemen Green spends 3 resources
78,2020-10-31 09:31:15,Green,III,19,Green builds Knights Green spends 1 resource
79,2020-10-31 09:31:08,Green,III,19,Green destroys Iron
80,2020-10-31 09:30:56,Green,III,19,Green destroys Alchemy
81,2020-10-31 09:30:48,Green,III,19,Green destroys Alchemy
82,2020-10-31 09:30:36,Green,III,19,Green discovers Military Theory 12 science spent
83,2020-10-31 09:30:28,Green,III,19,Green plays Mineral Deposits Green produces 4 resources
84,2020-10-31 09:30:20,Green,III,19,Green increases population Green spends 4 food
85,2020-10-31 09:30:13,Green,III,19,Action Phase begins
86,2020-10-31 09:30:13,Green,III,19,Green discards 2 cards
87,2020-10-31 09:30:08,Green,III,19,Discard Phase 2 military cards must be discarded
88,2020-10-31 09:30:08,Green,III,19,Green passes Political Phase
89,2020-10-31 08:51:54,Purple,III,19,End turn Purple scores: 1 food - consumption: 3 (now 4) 7 resources (now 8) Purple draws 3 military cards 12 culture (now 145) 0 science (now 6)
90,2020-10-31 08:51:37,Purple,III,19,Purple takes Mechanized Agriculture in hand 3 civil actions used
91,2020-10-31 08:50:40,Purple,III,19,Purple takes Fundamentalism in hand 1 civil action used
92,2020-10-31 08:50:35,Purple,III,19,Purple takes Military Theory in hand 1 civil action used
93,2020-10-31 08:49:00,Purple,III,19,Purple plays Revolutionary Idea
94,2020-10-31 08:48:35,Purple,III,19,Purple builds Air Forces Purple spends 7 resources
95,2020-10-31 08:48:21,Purple,III,19,Purple discovers Air Forces 11 science spent
96,2020-10-31 08:48:06,Purple,III,19,Action Phase begins
97,2020-10-31 08:48:05,Purple,III,19,Purple discards 3 cards
98,2020-10-31 08:42:08,Purple,III,19,Discard Phase 3 military cards must be discarded
99,2020-10-31 08:42:08,Grey,III,19,Grey declines offer
100,2020-10-31 07:20:44,Purple,III,19,Purple proposes Peace Treaty to Grey Purple is A Grey is B The two civilizations cannot attack each other. Each civilization produces 1 extra culture.
101,2020-10-31 07:17:29,Orange,III,19,End turn Orange scores: 3 food - consumption: 3 (now 9) 8 resources (now 11) Orange draws 2 military cards 22 culture (now 134) 8 science (now 16)
102,2020-10-31 07:16:35,Orange,III,19,Orange elects Thomas Cook Napoleon Bonaparte dies
103,2020-10-31 07:14:06,Orange,III,19,Orange takes Air Forces in hand 2 civil actions used
104,2020-10-31 07:13:53,Orange,III,19,Orange takes Thomas Cook in hand 1 civil action used
105,2020-10-31 07:13:47,Orange,III,19,Orange builds Opera Orange spends 9 resources
106,2020-10-31 07:13:41,Orange,III,19,Orange builds Opera Orange spends 9 resources
107,2020-10-31 07:13:36,Orange,III,19,Orange increases population Orange spends 5 food
108,2020-10-31 07:05:04,Orange,III,19,No Discard Phase
109,2020-10-31 07:05:04,Orange,III,19,Orange raids 2 Multimedia Orange produces 11 resources
110,2020-10-31 07:00:03,Purple,III,19,Purple concedes defeat
111,2020-10-30 22:40:14,Orange,III,19,"Orange plays Raid against Purple Destroy up to three of a rival's urban buildings of the same type and level. You produce resources equal to half the buildings' cost, rounded down. 3 military actions used"
112,2020-10-30 22:34:40,Grey,III,19,End turn Grey scores: 3 food - consumption: 3 (now 8) 6 resources (now 8) 12 culture (now 66) 8 science (now 14)
113,2020-10-30 22:34:27,Grey,III,18,Grey builds 1 stage of First Space Flight Grey spends 3 resources
114,2020-10-30 22:34:14,Grey,III,18,Grey discovers Journalism 6 science spent Isaac Newton gives 1 civil action back
115,2020-10-30 22:33:38,Grey,III,18,Grey takes Mineral Deposits in hand 3 civil actions used
116,2020-10-30 22:33:34,Grey,III,18,Grey takes Ideal Building Site in hand 3 civil actions used
117,2020-10-30 22:33:04,Grey,III,18,Grey upgrades Swordsmen to Modern Infantry Grey spends 4 resources
118,2020-10-30 22:32:52,Grey,III,18,No Discard Phase
119,2020-10-30 22:32:52,Grey,III,18,Grey declares War over Culture on Green The victor takes culture equal to the strength advantage from the defeated civilization. 3 military actions used
120,2020-10-30 22:25:38,Green,III,18,End turn Green scores: 2 food - consumption: 2 (now 4) 6 resources (now 8) Green draws 2 military cards 8 culture (now 108) 4 science (now 12)
121,2020-10-30 22:24:04,Green,III,18,Green takes Endowment for the Arts in hand 1 civil action used
122,2020-10-30 22:23:57,Green,III,18,Green puts Endowment for the Arts back in the row 1 civil action recovered
123,2020-10-30 22:19:44,Green,III,18,Green takes Endowment for the Arts in hand 1 civil action used
124,2020-10-30 22:18:08,Green,III,18,Green takes Mineral Deposits in hand 3 civil actions used
125,2020-10-30 22:17:58,Green,III,18,Green takes Engineering Genius in hand 2 civil actions used
126,2020-10-30 22:16:14,Green,III,18,No Discard Phase
127,2020-10-30 22:16:14,Green,III,18,Green passes Political Phase
128,2020-10-30 22:08:05,Purple,III,18,End turn Purple scores: John Amos Comenius produces 2 science 1 food - consumption: 3 (now 3) 7 resources (now 8) Purple draws 3 military cards 18 culture (now 133) 8 science (now 11)
129,2020-10-30 22:07:45,Purple,III,18,Purple builds Drama Purple spends 4 resources
130,2020-10-30 22:07:26,Purple,III,18,Purple upgrades Bronze to Coal Purple spends 6 resources
131,2020-10-30 22:07:14,Purple,III,18,Purple upgrades Printing Press to Multimedia using Efficient Upgrade Purple spends 2 resources
132,2020-10-30 22:06:59,Purple,III,18,Purple discovers Architecture 4 science spent
133,2020-10-30 22:06:50,Purple,III,18,Purple takes Air Forces in hand 3 civil actions used
134,2020-10-30 22:06:45,Purple,III,18,Action Phase begins
135,2020-10-30 22:06:45,Purple,III,18,Purple discards 1 cards
136,2020-10-30 21:57:21,Purple,III,18,Discard Phase 1 military card must be discarded
137,2020-10-30 21:57:21,Green,III,18,Green concedes defeat Purple wins 7 culture Green loses 7 culture
138,2020-10-30 21:53:53,Purple,III,18,Purple plays Armed Intervention against Green A rival loses 7 culture. You score 7 culture. 2 military actions used
139,2020-10-30 21:35:48,Orange,III,18,End turn Orange scores: 3 food - consumption: 3 (now 11) 8 resources (now 10) Orange draws 3 military cards 13 culture (now 112) 8 science (now 8)
140,2020-10-30 21:35:09,Orange,III,18,Orange discovers Strategy 8 science spent
141,2020-10-30 21:34:49,Orange,III,18,Orange builds Philosophy Orange spends 3 resources
142,2020-10-30 21:34:19,Orange,III,18,Orange increases population Orange spends 5 food
143,2020-10-30 21:34:14,Orange,III,18,Orange builds Journalism Orange spends 8 resources
144,2020-10-30 21:34:07,Orange,III,18,Orange takes Patriotism in hand 1 civil action used
145,2020-10-30 21:34:04,Orange,III,18,Orange takes Modern Infantry in hand 2 civil actions used
146,2020-10-30 21:32:57,Orange,III,18,No Discard Phase
147,2020-10-30 21:32:57,Purple,III,18,Purple colonizes a Wealthy Territory Sacrificed Units: 1 Knights 1 Colonization card +3 Total force: 5 Purple produces 8 resources
148,2020-10-30 21:30:06,Orange,III,18,Purple wins Wealthy Territory Winning bid is 5
149,2020-10-30 21:30:06,Orange,III,18,Orange passes
150,2020-10-30 21:04:03,Grey,III,18,Grey passes
151,2020-10-30 20:21:29,Green,III,18,Green passes
152,2020-10-30 20:07:06,Purple,III,18,Purple bids 5
153,2020-10-30 18:51:57,Orange,III,18,Orange bids 4
154,2020-10-30 18:50:11,Orange,III,18,Orange plays event Orange scores 3 culture Current event: II / Wealthy Territory 8 resources
155,2020-10-30 18:46:19,Grey,III,18,End turn Grey scores: 3 food - consumption: 3 (now 5) 6 resources (now 9) 12 culture (now 54) 8 science (now 12)
156,2020-10-30 18:44:46,Grey,III,17,Grey takes Efficient Upgrade in hand 1 civil action used
157,2020-10-30 18:44:27,Grey,III,17,Grey takes First Space Flight in hand 3 civil actions used
158,2020-10-30 18:43:57,Grey,III,17,Grey upgrades Swordsmen to Modern Infantry Grey spends 4 resources
159,2020-10-30 18:43:41,Grey,III,17,Grey upgrades Swordsmen to Modern Infantry Grey spends 1 resource
160,2020-10-30 18:43:28,Grey,III,17,Grey plays Military Build-Up Grey gets 3 resources to build military units
161,2020-10-30 18:43:20,Grey,III,17,Grey discovers Modern Infantry 8 science spent Isaac Newton gives 1 civil action back
162,2020-10-30 18:43:09,Grey,III,17,Grey builds Movies Grey spends 10 resources
163,2020-10-30 18:43:01,Grey,III,17,Grey increases population Grey spends 5 food
164,2020-10-30 18:42:51,Grey,III,17,Action Phase begins
165,2020-10-30 18:42:51,Grey,III,17,Grey discards 2 cards
166,2020-10-30 18:42:38,Grey,III,17,Discard Phase 2 military cards must be discarded
167,2020-10-30 18:42:38,Grey,III,17,Grey produces 8 resources Green spends 8 resources
168,2020-10-30 18:41:15,Green,III,17,Green concedes defeat
169,2020-10-30 18:41:09,Green,III,17,Green tries to defend Green strength: 5 Grey strength: 14
170,2020-10-30 18:39:33,Grey,III,17,Grey plays Plunder against Green A rival loses a total of 8 resources/food (your choice). You produce that many resources/food. 2 military actions used
171,2020-10-30 18:37:17,Green,III,17,End turn Green scores: 2 food - consumption: 2 (now 2) 6 resources (now 10) Green draws 2 military cards 8 culture (now 107) 4 science (now 8)
172,2020-10-30 18:16:47,Green,III,17,Green takes Oil in hand 2 civil actions used
173,2020-10-30 18:15:41,Green,III,17,Green takes Sagrada Familia in hand 3 civil actions used
174,2020-10-30 18:13:50,Green,III,17,Green builds Selective breeding using Rich Land Green spends 3 resources
175,2020-10-30 18:13:40,Green,III,17,Green increases population Green spends 4 food
176,2020-10-30 18:13:34,Green,III,17,No Discard Phase
177,2020-10-30 18:13:34,Green,III,17,Green passes Political Phase
178,2020-10-30 18:10:48,Purple,III,17,End turn Purple scores: John Amos Comenius produces 2 science 1 food - consumption: 3 (now 2) 5 resources (now 5) Purple draws 3 military cards 14 culture (now 108) 6 science (now 7)
179,2020-10-30 18:10:34,Purple,III,17,Purple takes Civil Service in hand 1 civil action used
180,2020-10-30 18:10:30,Purple,III,17,Purple takes Revolutionary Idea in hand 1 civil action used
181,2020-10-30 18:10:27,Purple,III,17,Purple takes Efficient Upgrade in hand 1 civil action used
182,2020-10-30 18:10:12,Purple,III,17,Purple increases population Purple spends 5 food
183,2020-10-30 18:10:08,Purple,III,17,Purple plays Bountiful Harvest Purple produces 4 food
184,2020-10-30 18:09:55,Purple,III,17,Purple upgrades Printing Press to Multimedia Purple spends 7 resources
185,2020-10-30 18:09:46,Purple,III,17,Purple discovers Multimedia 9 science spent
186,2020-10-30 18:09:29,Purple,III,17,Action Phase begins
187,2020-10-30 18:09:29,Purple,III,17,Purple discards 2 cards
188,2020-10-30 18:06:55,Purple,III,17,Discard Phase 2 military cards must be discarded
189,2020-10-30 18:06:55,Green,III,17,Green destroys Agriculture
190,2020-10-30 17:53:01,Purple,III,17,Green must destroy/disband Choose 1 building/mine/farm/unit
191,2020-10-30 17:53:01,Purple,III,17,Purple plays event Purple scores 2 culture Current event: II / Refugees The weakest civilization loses 3 culture and 1 population. The strongest gains 3 culture and 1 population. Orange gains 3 culture and 1 population Green loses 3 cultureand 1 population
192,2020-10-30 10:21:50,Orange,III,17,End turn Orange scores: 4 food - consumption: 2 (now 13) 4 resources - corruption: 4 (now 13) 11 culture (now 93) 5 science (now 8)
193,2020-10-30 10:21:26,Orange,III,17,Orange revolutions Change government to Republic 4 science points spent
194,2020-10-30 10:21:16,Orange,III,17,Action Phase begins
195,2020-10-30 10:21:16,Orange,III,17,Orange discards 2 cards
196,2020-10-30 10:11:11,Orange,III,17,Discard Phase 2 military cards must be discarded
197,2020-10-30 10:11:11,Green,III,17,Green defends Sacrificed Units: 1 Riflemen 1 Riflemen Green strength: 25 Orange strength: 25
198,2020-10-30 09:07:19,Orange,III,17,Orange plays Partitions against Green Take as many yellow token from your rival's bank as the level of your government and as many blue tokens as the level of your rival's government. Place the tokens in your bank. 3 military actions used
199,2020-10-30 08:57:04,Grey,III,17,End turn Grey scores: 3 food - consumption: 3 (now 7) 6 resources (now 10) Grey draws 3 military cards 8 culture (now 42) 8 science (now 12)
200,2020-10-30 08:56:53,Grey,III,16,Grey takes Modern Infantry in hand 2 civil actions used
201,2020-10-30 08:56:48,Grey,III,16,Grey plays Falles Movies is removed from the game Falles gives 1 civil action back
202,2020-10-30 08:56:25,Grey,III,16,Grey puts Modern Infantry back in the row 2 civil actions recovered
203,2020-10-30 08:56:22,Grey,III,16,Grey takes Modern Infantry in hand 2 civil actions used
204,2020-10-30 08:56:17,Grey,III,16,Grey takes Military Build-Up in hand 3 civil actions used
205,2020-10-30 08:56:09,Grey,III,16,Grey builds Movies using Ideal Building Site Grey spends 6 resources
206,2020-10-30 08:55:58,Grey,III,16,Grey increases population Grey spends 4 food
207,2020-10-30 08:55:54,Grey,III,16,Grey discovers Movies 10 science spent Isaac Newton gives 1 civil action back
208,2020-10-30 08:55:49,Grey,III,16,Action Phase begins
209,2020-10-30 08:55:49,Grey,III,16,Grey discards 1 cards
210,2020-10-30 08:55:45,Grey,III,16,Discard Phase 1 military card must be discarded
211,2020-10-30 08:55:45,Grey,III,16,Grey passes Political Phase
212,2020-10-30 06:40:37,Green,III,16,End turn Green scores: 0 food - consumption: 2 (now 4) 6 resources (now 7) 8 culture (now 102) 4 science (now 4)
213,2020-10-30 06:39:59,Green,III,16,Green takes Military Theory in hand 1 civil action used
214,2020-10-30 06:37:13,Green,III,16,Green plays Tactics II / Napoleonic Army
215,2020-10-30 06:37:06,Green,III,16,Green builds Cannon Green spends 5 resources
216,2020-10-30 06:36:56,Green,III,16,Green discovers Cannon 4 science spent
217,2020-10-30 06:36:44,Green,III,16,Green elects Winston Churchill Maximillien Robespierre dies
218,2020-10-30 06:36:29,Green,III,16,Green takes Winston Churchill in hand 2 civil actions used
219,2020-10-30 06:35:06,Green,III,16,Green plays Frugality Green increases population Green spends 4 food Green produces 3 food
220,2020-10-30 06:34:51,Green,III,16,Green plays Bountiful Harvest Green produces 3 food
221,2020-10-30 06:34:30,Green,III,16,No Discard Phase
222,2020-10-30 06:34:30,Green,III,16,Green passes Political Phase
223,2020-10-29 21:11:19,Purple,III,16,End turn Purple scores: John Amos Comenius produces 2 science 1 food - consumption: 3 (now 2) 5 resources (now 7) Purple draws 3 military cards 12 culture (now 92) 4 science (now 10)
224,2020-10-29 21:10:54,Purple,III,16,Purple takes Rockets in hand 1 civil action used
225,2020-10-29 21:10:33,Purple,III,16,Purple upgrades Agriculture to Irrigation Purple spends 2 resources
226,2020-10-29 21:10:27,Purple,III,16,Purple takes Bountiful Harvest in hand 2 civil actions used
227,2020-10-29 21:10:16,Purple,III,16,Purple builds Drama Purple spends 5 resources
228,2020-10-29 21:10:07,Purple,III,16,Purple takes Multimedia in hand 1 civil action used
229,2020-10-29 21:09:57,Purple,III,16,Purple plays Mineral Deposits Purple produces 3 resources
230,2020-10-29 21:09:44,Purple,III,16,Action Phase begins
231,2020-10-29 21:09:44,Purple,III,16,Purple discards 1 cards
232,2020-10-29 21:09:29,Purple,III,16,Discard Phase 1 military card must be discarded
233,2020-10-29 21:09:29,Purple,III,16,Purple plays event Purple scores 3 culture Current event: II / Crime Wave The two weakest civilizations lose 3 culture and 1 blue token. Purple loses 3 culture and 1 blue token Green loses 3 culture and 1 blue token
234,2020-10-29 20:59:22,Orange,III,16,End turn Orange scores: 4 food - consumption: 2 (now 9) 8 resources (now 9) Orange draws 3 military cards 11 culture (now 82) 5 science (now 7)
235,2020-10-29 20:58:58,Orange,III,16,Orange increases population Orange spends 4 food
236,2020-10-29 20:58:53,Orange,III,16,Orange builds Opera Orange spends 9 resources
237,2020-10-29 20:58:47,Orange,III,16,Orange increases population Orange spends 4 food
238,2020-10-29 20:58:42,Orange,III,16,Orange discovers Opera 7 science spent
239,2020-10-29 20:58:38,Orange,III,16,Action Phase begins
240,2020-10-29 20:58:38,Orange,III,16,Orange discards 1 cards
241,2020-10-29 20:56:04,Orange,III,16,Discard Phase 1 military card must be discarded
242,2020-10-29 20:56:04,Orange,III,16,Orange colonizes a Historic Territory Sacrificed Units: 1 Warrior 1 Warrior 1 Colonization card +2 Total force: 4 Orange scores 11 culture
243,2020-10-29 20:41:37,Grey,III,16,Orange wins Historic Territory Winning bid is 4
244,2020-10-29 20:41:37,Grey,III,16,Grey passes
245,2020-10-29 20:01:17,Green,III,16,Green passes
246,2020-10-29 13:42:20,Purple,III,16,Purple passes
247,2020-10-29 09:25:28,Orange,III,16,Orange bids 4
248,2020-10-29 09:23:07,Orange,III,16,Orange plays event Orange scores 3 culture Current event: II / Historic Territory 11 culture
249,2020-10-29 09:21:13,Grey,III,16,End turn Grey scores: 4 food - consumption: 2 (now 8) 6 resources (now 10) Grey draws 3 military cards 4 culture (now 34) 8 science (now 14)
250,2020-10-29 09:21:05,Grey,III,15,Grey takes Falles in hand 1 civil action used
251,2020-10-29 09:20:59,Grey,III,15,Grey takes Ideal Building Site in hand 2 civil actions used
252,2020-10-29 09:20:54,Grey,III,15,Grey upgrades Agriculture to Selective breeding Grey spends 4 resources
253,2020-10-29 09:20:33,Grey,III,15,Grey puts Military Theory back in the row 3 civil actions recovered
254,2020-10-29 09:20:29,Grey,III,15,Grey takes Movies in hand 3 civil actions used
255,2020-10-29 09:20:27,Grey,III,15,Grey takes Military Theory in hand 3 civil actions used
256,2020-10-29 09:20:21,Grey,III,15,Grey discovers Constitutional Monarchy 12 science spent Isaac Newton gives 1 civil action back
