,time,player,age,round,text
796,2020-12-10 10:34:08,Purple,I,3,End turn Purple scores: 1 food - consumption: 1 (now 1) 3 resources (now 3) Purple draws 2 military cards 1 culture (now 2) 1 science (now 3)
797,2020-12-10 10:33:37,Purple,I,3,Purple takes Revolutionary Idea in hand 1 civil action used
798,2020-12-10 10:33:08,Purple,I,3,Purple builds 1 stage of Pyramids Purple spends 3 resources
799,2020-12-10 10:32:47,Purple,I,3,Purple takes Charlemagne in hand 2 civil actions used
800,2020-12-10 10:32:27,Purple,I,3,Purple increases population Purple spends 2 food
801,2020-12-10 09:48:21,Purple,I,3,No Discard Phase
802,2020-12-10 09:48:21,Orange,I,3,Orange builds Religion
803,2020-12-10 09:23:41,Grey,I,3,Grey builds Religion
804,2020-12-10 08:45:53,Green,I,3,Green builds Religion
805,2020-12-09 20:16:26,Purple,I,3,Purple builds Religion
806,2020-12-09 20:16:16,Purple,I,3,Purple plays event Purple scores 1 culture Current event: A / Development of Religion Each player with an unused worker may immediately build an Age A temple for free.
807,2020-12-09 17:44:38,Orange,I,3,End turn Orange scores: 1 food - consumption: 1 (now 2) 3 resources (now 3) Orange draws 2 military cards 1 culture (now 2) 2 science (now 4)
808,2020-12-09 17:44:30,Orange,I,3,Orange takes Bountiful Harvest in hand 1 civil action used
809,2020-12-09 17:44:10,Orange,I,3,Orange builds Religion Orange spends 3 resources
810,2020-12-09 17:44:06,Orange,I,3,Orange elects Confucius
811,2020-12-09 17:44:01,Orange,I,3,Orange plays Frugality Orange increases population Orange spends 2 food Orange produces 1 food
812,2020-12-09 17:43:51,Orange,I,3,No Discard Phase
813,2020-12-09 17:43:51,Orange,I,3,Orange plays event Orange scores 1 culture Current event: A / No Event
814,2020-12-09 15:11:07,Grey,I,3,End turn Grey scores: 2 food - consumption: 0 (now 2) 2 resources (now 4) Grey draws 2 military cards 0 culture (now 0) 1 science (now 2)
815,2020-12-09 15:07:21,Grey,I,2,Grey increases population Grey spends 2 food
816,2020-12-09 15:06:14,Grey,I,2,Grey takes Engineering Genius in hand 1 civil action used
817,2020-12-09 15:06:10,Grey,I,2,Grey takes Parthenon in hand 2 civil actions used
818,2020-12-09 14:58:16,Green,I,2,End turn Green scores: 2 food - consumption: 0 (now 3) 2 resources (now 2) Green draws 3 military cards 0 culture (now 0) 2 science (now 3)
819,2020-12-09 14:58:05,Green,I,2,Green takes Rich Land in hand 1 civil action used
820,2020-12-09 14:57:57,Green,I,2,Green plays Frugality Green increases population Green spends 2 food Green produces 1 food
821,2020-12-09 14:57:51,Green,I,2,Green elects Julius Caesar
822,2020-12-09 14:57:46,Green,I,2,Green builds Philosophy using Ideal Building Site Green spends 2 resources
823,2020-12-09 14:56:32,Purple,I,2,End turn Purple scores: 2 food - consumption: 0 (now 2) 3 resources (now 3) Purple draws 2 military cards 0 culture (now 0) 1 science (now 2)
824,2020-12-09 14:56:06,Purple,I,2,Purple takes Pyramids in hand 2 civil actions used
825,2020-12-09 14:55:44,Purple,I,2,Purple increases population Purple spends 2 food
826,2020-12-09 14:55:39,Purple,I,2,Purple builds Bronze Purple spends 2 resources
827,2020-12-09 14:55:32,Purple,I,2,Purple elects Hammurabi
828,2020-12-09 14:46:22,Orange,I,2,Action Phase begins
829,2020-12-09 14:46:22,Orange,I,2,End turn Orange scores: 2 food - consumption: 0 (now 2) 3 resources (now 3) Orange draws 2 military cards 0 culture (now 0) 1 science (now 2)
830,2020-12-09 14:46:15,Orange,I,2,Orange takes Patriotism in hand 1 civil action used
831,2020-12-09 14:46:12,Orange,I,2,Orange takes Frugality in hand 1 civil action used
832,2020-12-09 14:45:56,Orange,I,2,Orange builds Bronze Orange spends 2 resources
833,2020-12-09 14:45:50,Orange,I,2,Orange increases population Orange spends 2 food
834,2020-12-09 14:28:55,Grey,I,2,Action Phase begins
835,2020-12-09 14:28:55,Grey,I,2,End turn Grey scores: 2 food - consumption: 0 (now 2) 2 resources (now 2) 0 culture (now 0) 1 science (now 1) Age I begins.
836,2020-12-09 14:27:33,Grey,A,1,Grey takes Rich Land in hand 2 civil actions used
837,2020-12-09 14:27:30,Grey,A,1,Grey takes Ramesses II in hand 2 civil actions used
838,2020-12-09 14:00:21,Green,A,1,Action Phase begins
839,2020-12-09 14:00:21,Green,A,1,End turn Green scores: 2 food - consumption: 0 (now 2) 2 resources (now 2) 0 culture (now 0) 1 science (now 1)
840,2020-12-09 14:00:03,Green,A,1,Green takes Julius Caesar in hand 1 civil action used
841,2020-12-09 13:59:59,Green,A,1,Green takes Frugality in hand 1 civil action used
842,2020-12-09 13:59:55,Green,A,1,Green takes Ideal Building Site in hand 1 civil action used
843,2020-12-09 13:59:44,Green,A,1,Green puts Julius Caesar back in the row 1 civil action recovered
844,2020-12-09 13:59:34,Green,A,1,Green takes Julius Caesar in hand 1 civil action used
845,2020-12-09 13:38:49,Purple,A,1,Action Phase begins
846,2020-12-09 13:38:49,Purple,A,1,End turn Purple scores: 2 food - consumption: 0 (now 2) 2 resources (now 2) 0 culture (now 0) 1 science (now 1)
847,2020-12-09 13:38:19,Purple,A,1,Purple takes Hammurabi in hand 2 civil actions used
848,2020-12-09 12:34:44,Orange,A,1,Action Phase begins
849,2020-12-09 12:34:44,Orange,A,1,End turn Orange scores: 2 food - consumption: 0 (now 2) 2 resources (now 2) 0 culture (now 0) 1 science (now 1)
850,2020-12-09 12:34:30,Orange,A,1,Orange takes Confucius in hand 1 civil action used
851,2020-12-09 10:26:28,Orange,A,1,Game 🐪 day - Episode VI Turn of the Jedi created.
